{
  "branch": "research/level2-energy-regime",
  "campaign_id": "level2-energy-regime-v1",
  "campaign_status": "COMPLETE",
  "frozen_preregistration_commit": "2d4c859db7939da51ee7d919889a18f4c7e229ed",
  "geometries": [
    {
      "a_qq": {
        "delta_hl_s2": {
          "reason": null,
          "value": 0.0
        },
        "delta_hl_s3": {
          "reason": null,
          "value": 0.03472222222222243
        },
        "delta_hm_s2": {
          "reason": null,
          "value": -0.05136986301369861
        },
        "delta_hm_s3": {
          "reason": null,
          "value": 0.0
        },
        "delta_ml_s2": {
          "reason": null,
          "value": 0.05136986301369861
        },
        "delta_ml_s3": {
          "reason": null,
          "value": 0.03472222222222243
        },
        "metric": "A_QQ"
      },
      "geometry": "ring4",
      "m_qq": {
        "delta_hl_s2": {
          "reason": null,
          "value": 0.034741636495151496
        },
        "delta_hl_s3": {
          "reason": null,
          "value": 0.023097563037031532
        },
        "delta_hm_s2": {
          "reason": null,
          "value": 0.03349791450698436
        },
        "delta_hm_s3": {
          "reason": null,
          "value": 0.017058928121723216
        },
        "delta_ml_s2": {
          "reason": null,
          "value": 0.0012437219881671346
        },
        "delta_ml_s3": {
          "reason": null,
          "value": 0.006038634915308316
        },
        "metric": "M_QQ"
      },
      "m_tt": {
        "c_x_23": {
          "reason": null,
          "value": -0.04090283144144193
        },
        "d_x_23": {
          "reason": null,
          "value": 1.4429225743845608
        },
        "delta_hl_s2": {
          "reason": null,
          "value": -0.007742838926974305
        },
        "delta_hl_s3": {
          "reason": null,
          "value": -0.005857982377896448
        },
        "direction_s2": "NEGATIVE",
        "direction_s3": "NEGATIVE",
        "metric": "M_TT",
        "taxonomy": "SAME_INTER_S_DIRECTION"
      },
      "r_eff": {
        "c_x_23": {
          "reason": null,
          "value": 0.11613297956586083
        },
        "d_x_23": {
          "reason": null,
          "value": 1.329579810321566
        },
        "delta_hl_s2": {
          "reason": null,
          "value": -0.0020882959675153634
        },
        "delta_hl_s3": {
          "reason": null,
          "value": -0.0021358495740230188
        },
        "direction_s2": "NEGATIVE",
        "direction_s3": "NEGATIVE",
        "metric": "R_eff",
        "taxonomy": "SAME_INTER_S_DIRECTION"
      }
    },
    {
      "a_qq": {
        "delta_hl_s2": {
          "reason": null,
          "value": 0.015999999999999903
        },
        "delta_hl_s3": {
          "reason": null,
          "value": 0.01196808510638303
        },
        "delta_hm_s2": {
          "reason": null,
          "value": -0.03399999999999992
        },
        "delta_hm_s3": {
          "reason": null,
          "value": 0.0
        },
        "delta_ml_s2": {
          "reason": null,
          "value": 0.04999999999999982
        },
        "delta_ml_s3": {
          "reason": null,
          "value": 0.01196808510638303
        },
        "metric": "A_QQ"
      },
      "geometry": "ring5",
      "m_qq": {
        "delta_hl_s2": {
          "reason": null,
          "value": 0.020202352134593093
        },
        "delta_hl_s3": {
          "reason": null,
          "value": 0.046124103926328375
        },
        "delta_hm_s2": {
          "reason": null,
          "value": 0.020356557751754822
        },
        "delta_hm_s3": {
          "reason": null,
          "value": 0.03797474469853673
        },
        "delta_ml_s2": {
          "reason": null,
          "value": -0.00015420561716172898
        },
        "delta_ml_s3": {
          "reason": null,
          "value": 0.008149359227791642
        },
        "metric": "M_QQ"
      },
      "m_tt": {
        "c_x_23": {
          "reason": null,
          "value": 0.012987171802246213
        },
        "d_x_23": {
          "reason": null,
          "value": 1.4052852928874415
        },
        "delta_hl_s2": {
          "reason": null,
          "value": -0.005818691260019174
        },
        "delta_hl_s3": {
          "reason": null,
          "value": 0.004351133007983621
        },
        "direction_s2": "NEGATIVE",
        "direction_s3": "POSITIVE",
        "metric": "M_TT",
        "taxonomy": "OPPOSITE_INTER_S_DIRECTION"
      },
      "r_eff": {
        "c_x_23": {
          "reason": null,
          "value": 0.01952155882157506
        },
        "d_x_23": {
          "reason": null,
          "value": 1.402480260102137
        },
        "delta_hl_s2": {
          "reason": null,
          "value": 0.002277479585917397
        },
        "delta_hl_s3": {
          "reason": null,
          "value": -0.009134320925960226
        },
        "direction_s2": "POSITIVE",
        "direction_s3": "NEGATIVE",
        "metric": "R_eff",
        "taxonomy": "OPPOSITE_INTER_S_DIRECTION"
      }
    },
    {
      "a_qq": {
        "delta_hl_s2": {
          "reason": null,
          "value": 3.3306690738754696e-16
        },
        "delta_hl_s3": {
          "reason": null,
          "value": 0.09375
        },
        "delta_hm_s2": {
          "reason": null,
          "value": -0.13636363636363602
        },
        "delta_hm_s3": {
          "reason": null,
          "value": 0.0
        },
        "delta_ml_s2": {
          "reason": null,
          "value": 0.13636363636363635
        },
        "delta_ml_s3": {
          "reason": null,
          "value": 0.09375
        },
        "metric": "A_QQ"
      },
      "geometry": "triangle",
      "m_qq": {
        "delta_hl_s2": {
          "reason": null,
          "value": 0.0
        },
        "delta_hl_s3": {
          "reason": null,
          "value": 0.0
        },
        "delta_hm_s2": {
          "reason": null,
          "value": 0.0
        },
        "delta_hm_s3": {
          "reason": null,
          "value": 0.0
        },
        "delta_ml_s2": {
          "reason": null,
          "value": 0.0
        },
        "delta_ml_s3": {
          "reason": null,
          "value": 0.0
        },
        "metric": "M_QQ"
      },
      "m_tt": {
        "c_x_23": {
          "reason": null,
          "value": 0.03810261500220246
        },
        "d_x_23": {
          "reason": null,
          "value": 1.3878668932597007
        },
        "delta_hl_s2": {
          "reason": null,
          "value": -0.004126671615421296
        },
        "delta_hl_s3": {
          "reason": null,
          "value": -0.019478063957488134
        },
        "direction_s2": "NEGATIVE",
        "direction_s3": "NEGATIVE",
        "metric": "M_TT",
        "taxonomy": "SAME_INTER_S_DIRECTION"
      },
      "r_eff": {
        "c_x_23": {
          "reason": null,
          "value": 0.06720497447792737
        },
        "d_x_23": {
          "reason": null,
          "value": 1.3676673156151988
        },
        "delta_hl_s2": {
          "reason": null,
          "value": 0.0019610736818521657
        },
        "delta_hl_s3": {
          "reason": null,
          "value": 0.008366750093282582
        },
        "direction_s2": "POSITIVE",
        "direction_s3": "POSITIVE",
        "metric": "R_eff",
        "taxonomy": "SAME_INTER_S_DIRECTION"
      }
    }
  ],
  "manifest_fingerprint": "82dca9dee756f531375b31540b4f7d05c2c8ba1760150f2d9972f12a5da06fa4",
  "repository": "ioio2995/cosmobox",
  "repository_commit": "1feb03f41f9e73078efbc760dd2cba2b667e2ed0",
  "schema_version": "level2-campaign-summary-v1"
}
